judul,waktu,kategori,deskripsi
"Tantangan Pendidikan Dasar Makin Kompleks, Butuh Inovasi dalam Pembelajaran","Rabu, 15 Juni 2022 - 22:52 WIB",Kampus,"Pendidikan dasar di masa datang akan menghadapi tantangan yang kompleks. Salah satunya, perkembangan teknologi informasi yang makin maju dan membutuhkan inovasi."
,,,
"Tantangan Pendidikan Dasar Makin Kompleks, Butuh Inovasi dalam Pembelajaran","Rabu, 15 Juni 2022 - 22:52 WIB",Kampus,"Pendidikan dasar di masa datang akan menghadapi tantangan yang kompleks. Salah satunya, perkembangan teknologi informasi yang makin maju dan membutuhkan inovasi."
"Perjuangan Riska, Anak TKI yang Lolos Beasiswa ke University of British Columbia","Rabu, 15 Juni 2022 - 22:07 WIB",Beasiswa,"Riska, anak dari seorang Pekerja Imigran Indonesia (PMI) di Sekolah Indonesia Kota Kinibalu, Malaysia, berhasil memperoleh beasiswa jenjang S1 ke University of British Columbia di Kanada."
"Ini 6 Kampus dengan Fakultas Kedokteran Terbaik di Dunia, Buruan Daftar","Rabu, 15 Juni 2022 - 20:06 WIB",Kampus,"Sedikitnya ada enam kampus kedokteran terbaik di dunia. Dalam perkembangannya, jurusan kedokteran menjadi salah satu jurusan paling populer di perguruan tinggi."
Partai Perindo: Mars Partai Perindo dengan QR Code,,Video,"Lahir dari semangat untuk mengembalikan cita-cita kemerdekaan, Partai Perindo hadir untuk membangun Indonesia menjadi negara bersatu, berdaulat, adil dan makmur berlandaskan Pancasila."
Bangga! Mahasiswi Politeknik Ini Raih Beasiswa IISMAVO 2022 dari Kemendikbudristek,"Rabu, 15 Juni 2022 - 19:30 WIB",Beasiswa,"Mahasiswi Politeknik Negeri Banjarmasin (Poliban) Kalimantan Selatan, Dinda Nurainunnajah meraih beasiswa IISMAVO 2022 dari Kemendikbudristek."
"Lulus Sidang Terbuka, Wakil Direktur Kajian CTRS-PTIK Sandang Gelar Doktor","Rabu, 15 Juni 2022 - 19:01 WIB",Kampus,Wakil Direktur Kajian Pusat Studi Terorisme dan Radikalisme Sekolah Tinggi Ilmu Kepolisian (STIK/PTIK) Tety Machyawaty resmi menyandang gelar doktor ilmu kepolisian.
"5 Kampus dengan Jurusan Seni Rupa Terbaik di Indonesia, Bisa Jadi Referensi","Rabu, 15 Juni 2022 - 17:19 WIB",Kampus,"Cukup banyak anak muda saat ini yang memiliki kemampuan dan cita-cita menjadi seorang seniman seperti pelukis, penari, pematung, atau bahkan bercita-cita menjadi seorang sutradara dan animator."
"Kabar Baik, Lulusan SMK Kini Bisa Tempuh Sarjana di Jerman","Rabu, 15 Juni 2022 - 16:35 WIB",Sekolah,Atdikbud KBRI Berlin Ardi Marwan menjelaskan mulai 2022 siswa SMK dari Indonesia berkesempatan melanjutkan pendidikan sarjana di berbagai universitas di Jerman.
"Gelar Wisuda 2022, ISTN Lahirkan 423 Sarjana Berkualitas dan Unggul","Rabu, 15 Juni 2022 - 15:19 WIB",Kampus,"Institut Sains dan Teknologi Nasional (ISTN) menggelar wisuda untuk Program Diploma, Sarjana, Profesi Apoteker dan Pascasarjana semester ganjil Tahun Akademik 2021/2022."
UPN Veteran Jakarta Buka Penerimaan Mahasiswa Baru Jalur Seleksi Mandiri,"Rabu, 15 Juni 2022 - 13:26 WIB",Kampus,Universitas Pembangunan Nasional Veteran Jakarta (UPNVJ) mulai membuka penerimaan mahasiswa baru jalur Seleksi Mandiri jenjang SI pada 14 Juni 2022.
,,,
Siswa MAN IC Pasuruan Juara II Kompetisi Internasional Science 2022 di AS,"Rabu, 15 Juni 2022 - 12:07 WIB",Sekolah,Prestasi internasional kembali ditorehkan siswi MAN IC Pasuruan. Salwa Putri dinobatkan sebagai juara kedua Internasional Science Without Borders Challenge 2022.
Prodi MICE PNJ Gelar Event INAMICE 2022,"Rabu, 15 Juni 2022 - 11:53 WIB",Kampus,Program Studi MICE Politeknik Negeri Jakarta (PNJ) bersama dengan Kementerian Pariwisata dan Ekonomi Kreatif (Kemenparekraf) menyelenggarakan INAMICE 2022.
"15 Universitas Terbaik dengan Jurusan Akuntansi, Ini Daftarnya","Rabu, 15 Juni 2022 - 11:46 WIB",Kampus,Mereka yang memutuskan untuk menempuh kuliah jurusan akuntansi tentu harus memahami apa yang akan mereka pelajari nantinya. Jurusan kuliah ini memiliki peluang kerja cukup tinggi.
"PPDB Jateng 2022 SMA-SMK Dimulai Hari Ini, Cek Jadwal, Syarat, dan Alur Pendaftarannya","Rabu, 15 Juni 2022 - 10:13 WIB",Sekolah,PPDB jenjang SMA dan SMK 2022 di Provinsi Jawa Tengah (Jateng) mulai dibuka. Pendaftaran dilakukan secara online di laman resmi ppdb.jatengprov.go.id.
"Justin Bieber Terkena Ramsay Hunt, Pakar Unair Ungkap Gejala dan Penyembuhannya","Rabu, 15 Juni 2022 - 09:05 WIB",Kampus,"Justin Bieber mengumumkan dirinya terkena Ramsay Hunt Syndrome., Dosen Fakultas Kedokteran Unair pun membeberkan mengenai gejala dan metode penyembuhannya."
"Wabah PMK Merebak, Ini Tips Pilih Hewan Kurban dari Pakar UGM","Rabu, 15 Juni 2022 - 08:19 WIB",Kampus,Direktur Pusat Kajian Halal Fakultas Peternakan UGM mengimbau masyarakat untuk meningkatkan kewaspadaan saat membeli hewan ternak jelang hari raya kurban.
"Program Internasionalisasi Kampus, UP Jalin Kerja Sama dengan TUI Jerman","Rabu, 15 Juni 2022 - 07:57 WIB",Kampus,Universitas Pancasila (UP) pada hari Selasa (14/6/2022) menandatangani Memorandum of Understanding (MOU) dengan Technische Universitt Ilmenau (TUI) Jerman.
"Kisah Inspiratif, Anak Penjual Petis Dilantik Jadi Rektor UINSA Surabaya","Rabu, 15 Juni 2022 - 05:17 WIB",Kampus,Prof. Akhmad Muzakki membuktikan diri bahwa latar belakang ekonomi keluarga yang biasa-biasa saja tidak menghalangi cita-citanya untuk menjadi orang sukses.
Ners Unair: 6 Vitamin untuk Kulit agar Tetap Sehat dan Jenis Makanannya,"Selasa, 14 Juni 2022 - 22:12 WIB",Kampus,Fakultas Keperawatan Universitas Airlangga(Ners Unair) menyebutkan berbagai jenis vitamin yang cocok untuk kulit. Vitamin apa saja itu?
Alumni SMA Pradita Dirgantara Raih Beasiswa di University of Chicago AS,"Selasa, 14 Juni 2022 - 21:57 WIB",Beasiswa,"Walau masih berusia belia, namun prestasi SMA Pradita Dirgantara tidak diragukan lagi. Terbukti banyak alumninya yang mendapatkan beasiswa di dalam maupun luar negeri."
Prodi Penmas FIP UNJ Gelar Seminar Internasional dan Munas Hapenmasi,"Selasa, 14 Juni 2022 - 20:20 WIB",Kampus,"Program Studi Pendidikan Masyarakat, Fakultas Ilmu Pendidikan Universitas Negeri Jakarta (Prodi Penmas FIP UNJ) menyelenggarakan seminar internasional ."
"Diikuti 7.038 Peserta, UIN Jakarta Gelar Seleksi UM-PTKIN","Selasa, 14 Juni 2022 - 19:31 WIB",Kampus,Universitas Islam Negeri Syarif Hidayatullah (UIN Jakarta) memulai hari pertama seleksi Ujian Masuk Perguruan Tinggi Keagamaan Islam Negeri (UM-PTKIN) 2022.
Tertarik Jadi Guru? Daftar Pendidikan Profesi Guru Kemendikbudristek 2022,"Selasa, 14 Juni 2022 - 19:13 WIB",Kampus,Ditjen GTK Kemendikbudristek mengundang putra-putri terbaik bangsa untuk mengikuti seleksi calon Mahasiswa Program Pendidikan Profesi Guru (PPG) Prajabatan 2022.
"Ini 4 Kampus Luar Jawa dengan Fakultas Kedokteran Terbaik, Nomor Terakhir di Sumatera Utara","Selasa, 14 Juni 2022 - 18:22 WIB",Kampus,"Sedikitnya ada empat jurusan kedokteran terbaik di Indobesia yang bisa diketahui. Meskipun terkenal dengan biaya kuliah yang mahal, namun jurusan ini bisa memberikan prospek yang bagus bagi lulusannya."
"Seleksi Wilayah Kontes Robot Indonesia 2022 Berakhir, ITS Juarai 4 Kategori","Selasa, 14 Juni 2022 - 17:46 WIB",Kampus,Institut Teknologi Sepuluh Nopember (ITS) berhasil menuntaskan kewajiban sebagai tuan rumah Kontes Robot Indonesia (KRI) Tingkat Wilayah bersama Puspresnas.
Polsri dan Trakindo Berbagi Wawasan Bantu Siapkan Mahasiswa Berkarier,"Selasa, 14 Juni 2022 - 17:04 WIB",Kampus,"Berkolaborasi dengan Politeknik Negeri Sriwijaya (Polsri), Trakindo kembali menggelar Trakindo Goes to Campus (TGTC) yang diikuti 526 mahasiswa dan pengajar."
,,,
,,,
,,,
,,,
